source,author,title,description,url,urlToImage,publishedAt,content
"{'id': 'bbc-news', 'name': 'BBC News'}",BBC News,Covid: US House votes to boost stimulus package payments,"The chamber backs President Trump's call for $2,000 payments but the move could stall in the Senate.",http://www.bbc.co.uk/news/world-us-canada-55471647,https://ichef.bbci.co.uk/news/1024/branded_news/DE88/production/_116286965_gettyimages-1230097453.jpg,2020-12-29T02:37:22.8665351Z,"image copyrightGetty Images
image captionThe pandemic has devastated the US economy and caused a surge in unemployment
The US House of Representatives has voted in favour of increasing the aid sent… [+3075 chars]"
"{'id': 'bbc-news', 'name': 'BBC News'}",BBC News,When online meetings didn’t go as planned,"From animal interruptions to catching fire, here's a look back at the year we spent (badly) online.",http://www.bbc.co.uk/news/world-55375825,https://ichef.bbci.co.uk/images/ic/400xn/p092mw4b.jpg,2020-12-29T00:22:24.3846859Z,"2020 was the year everything went online. From virtual meetings and teaching online to socialising on a screen, a lot of us have spent a lot of time logged in.
But with interruptions from pets and c… [+197 chars]"
"{'id': 'bbc-news', 'name': 'BBC News'}",BBC News,Coronavirus: Spain to keep registry of those who refuse Covid vaccine,"Vaccination will not be mandatory, officials say, and the register will not be made public.",http://www.bbc.co.uk/news/world-europe-55471282,https://ichef.bbci.co.uk/news/1024/branded_news/E144/production/_116286675_064969673.jpg,2020-12-29T00:22:20.541892Z,"image captionThe elderly are among those receiving the first wave of vaccinations in Spain
Spain is to set up a registry of people who refuse to be vaccinated against coronavirus and share it with o… [+2052 chars]"
"{'id': 'bbc-news', 'name': 'BBC News'}",BBC News,Nashville explosion: Motives still unclear in Nashville 'suicide bomb',Investigators are trying to work out the motive behind the Christmas Day blast that injured three.,http://www.bbc.co.uk/news/world-us-canada-55468759,https://ichef.bbci.co.uk/news/1024/branded_news/11A22/production/_116262227_35c1f445-9ede-4644-94ff-6376ad96a1df.jpg,2020-12-28T22:52:22.2325734Z,"media captionWatch the aftermath of the explosion in Nashville
US investigators are trying to find out why a 63-year-old computer consultant detonated a bomb that killed himself and injured three ot… [+2705 chars]"
"{'id': 'bbc-news', 'name': 'BBC News'}",BBC News,Joe Biden: 'Enormous damage' to US security agencies by Trump,The president-elect says his team is not getting the information it needs on national security.,http://www.bbc.co.uk/news/world-us-canada-55470625,https://ichef.bbci.co.uk/news/1024/branded_news/5F94/production/_116286442_064981892-1.jpg,2020-12-28T22:22:22.5033425Z,"Agencies critical to US security have suffered ""enormous damage"" at the hands of the Trump administration, US President-elect Joe Biden has said.
Mr Biden said his team was not getting the informati… [+1946 chars]"
"{'id': 'bbc-news', 'name': 'BBC News'}",BBC News,Covid: South Africa's Ramaphosa announces new restrictions as cases soar,"The measures include a ban on indoor and outdoor gatherings, and a night curfew, until 15 January.",http://www.bbc.co.uk/news/world-africa-55468104,https://ichef.bbci.co.uk/news/1024/branded_news/D4EC/production/_116280545_mediaitem116280544.jpg,2020-12-28T19:22:21.2057413Z,"image captionMr Ramaphosa said the country had let its guard down
President Cyril Ramaphosa has announced new tougher coronavirus restrictions, a day after South Africa recorded more than one millio… [+2585 chars]"
"{'id': 'bbc-news', 'name': 'BBC News'}",BBC News,Hilaria Baldwin denies faking her Spanish heritage,The wife of Alec Baldwin has been accused of misleading the public over her Spanish heritage.,http://www.bbc.co.uk/news/world-us-canada-55468754,https://ichef.bbci.co.uk/news/1024/branded_news/14922/production/_116285248_mediaitem116285244.jpg,2020-12-28T17:22:21.0407189Z,"image copyrightGetty Images
image captionThe TV host has been accused of faking a Spanish accent
Hilaria Baldwin, TV host and wife of actor Alec Baldwin, has responded to accusations she misled the… [+1797 chars]"
"{'id': 'bbc-news', 'name': 'BBC News'}",BBC News,Covid-19: Concern at 'unprecedented' infection level in England,"The UK reports a further 41,385 cases as hospitals struggle to cope with rising patient numbers.",http://www.bbc.co.uk/news/uk-55462701,https://ichef.bbci.co.uk/news/1024/branded_news/7889/production/_116275803_mediaitem116275477.jpg,2020-12-28T17:07:19.8638005Z,"England's ""very high"" Covid infection level is a ""growing concern"" as the NHS struggles to cope with rising patient numbers, a health official has said.
On Monday, a further 41,385 Covid cases and 3… [+5504 chars]"
"{'id': 'bbc-news', 'name': 'BBC News'}",BBC News,Loujain al-Hathloul: Saudi woman activist jailed for five years,"Loujain al-Hathloul, 31, was prominent in the campaign to win the right for Saudi women to drive.",http://www.bbc.co.uk/news/world-middle-east-55467414,https://ichef.bbci.co.uk/news/1024/branded_news/113E0/production/_115242607_mediaitem115237706.jpg,2020-12-28T13:07:20.5474276Z,"image captionLoujain al-Hathloul was detained in 2018
A prominent Saudi female activist, who campaigned for women's right to drive, has been sentenced to more than five years in prison. 
Loujain al… [+2032 chars]"
"{'id': 'bbc-news', 'name': 'BBC News'}",BBC News,Brexit: Britons warned to prepare for 'some disruption',"Ministers warn of ""practical and procedural changes"" when the Brexit transition period ends this week.",http://www.bbc.co.uk/news/uk-55463506,https://ichef.bbci.co.uk/news/1024/branded_news/EDB9/production/_116275806_mediaitem116275805.jpg,2020-12-28T07:52:23.5254222Z,"Businesses and travellers should get ready for ""substantial"" change from New Year's Eve, when the UK leaves the EU, the government has said.
Cabinet Office Minister Michael Gove said there would be … [+3900 chars]"
"{'id': 'mashable', 'name': 'Mashable'}",Adam Rosenberg,Photos of an extremely cool-looking Macintosh Classic prototype surface online,"Apple's Macintosh Classic launched in 1990 as an affordable home computing option. Now, 30 years later, there are photos on Twitter of a purported Classic prototype in a clear case.
I'm no Apple expert. I'll also be the first to acknowledge that hoaxes are so…",https://mashable.com/article/apple-macintosh-classic-prototype-photos/,https://mondrian.mashable.com/2020%252F12%252F06%252F41%252F7ca63ba3f9bc4abe80560f0a0e6b9bd4.140c4.png%252F1200x630.png?signature=OMHP88PgUyGN1Oxe7lCr0vTPLaA=,2020-12-06T22:33:52Z,"Apple's Macintosh Classic launched in 1990 as an affordable home computing option. Now, 30 years later, there are photos on Twitter of a purported Classic prototype in a clear case.
I'm no Apple exp… [+2210 chars]"
"{'id': None, 'name': 'MacRumors'}",Hartley Charlton,Images of Prototype Apple Macintosh With Clear Casing Shared Online,"Twitter user @DongleBookPro has shared images of a prototype original Macintosh with a translucent casing.







The Apple Macintosh, later called the Macintosh 128K, was the original Apple Macintosh personal computer released in 1984. The Macintosh was intr…",https://www.macrumors.com/2020/12/06/prototype-apple-macintosh/,https://images.macrumors.com/t/PTso4yqg8YrQIOUHUdEiT-OffYU=/1600x/https://images.macrumors.com/article-new/2020/12/macintosh-clear-prototype-1.jpeg,2020-12-06T17:20:08Z,"Twitter user @DongleBookPro has shared images of a prototype original Macintosh with a translucent casing.
The Apple Macintosh, later called the Macintosh 128K, was the original Apple Macintosh pers… [+1101 chars]"
"{'id': None, 'name': 'MacRumors'}",Hartley Charlton,iOS 14.2 Reportedly Causing Severe Battery Drain,"Users on the Apple Developer forums and Reddit are widely reporting that iOS 14.2 causes severe battery drain issues.







Symptoms of the problem include rapid battery drain and longer charge times than usual. Some users are reporting that their devices ar…",https://www.macrumors.com/2020/12/06/ios-14-2-reportedly-causing-severe-battery-drain/,https://images.macrumors.com/t/0ncg6RwGimTn3MmscdKw6nMhI6I=/2904x/https://images.macrumors.com/article-new/2020/10/iOS14.2on-Phone-Feature-2.jpg,2020-12-06T19:23:37Z,"Users on the Apple Developer forums and Reddit are widely reporting that iOS 14.2 causes severe battery drain issues.
Symptoms of the problem include rapid battery drain and longer charge times than… [+1580 chars]"
"{'id': None, 'name': 'MacRumors'}",Frank McShan,Waze Integration With CarPlay Dashboard Goes Live,"After a period of beta testing, Waze is now able to directly integrate with Apple CarPlay's multiscreen dashboard, as noted by users of the navigation app on the MacRumors forums.





In addition to support for the dashboard mode, the update appears to intro…",https://www.macrumors.com/2020/12/06/waze-carplay-dashboard-goes-live/,https://images.macrumors.com/t/jeWA_c4MuhbG3U7_VNTJ5s6NGUc=/1600x/https://images.macrumors.com/article-new/2020/12/Waze-Carplay-Interface.png,2020-12-06T23:29:48Z,"After a period of beta testing, Waze is now able to directly integrate with Apple CarPlay's multiscreen dashboard, as noted by users of the navigation app on the MacRumors forums.
In addition to sup… [+607 chars]"
"{'id': None, 'name': '9to5Mac'}",Chance Miller,Here’s what Apple’s physical App Store award looks like in the real-world,"Apple this week officially announced its 2020 App Store Best award winners, recognizing outstanding apps and games for iPhone, iPad, Apple Watch, Apple TV, and Mac. This year, Apple also the winners with a physical award. Here’s what it looks like in the real…",https://9to5mac.com/2020/12/06/physical-app-store-award-gallery/,https://i0.wp.com/9to5mac.com/wp-content/uploads/sites/6/2020/12/EoOJOSSVoAYgh5A-2-2.jpeg?resize=1200%2C628&quality=82&strip=all&ssl=1,2020-12-06T19:29:34Z,"Apple this week officially announced its 2020 App Store Best award winners, recognizing outstanding apps and games for iPhone, iPad, Apple Watch, Apple TV, and Mac. This year, Apple also the winners … [+2041 chars]"
"{'id': None, 'name': 'AppleInsider'}",news@appleinsider.com (Stephen Silver),"Atlanta Apple Store shooting arrest, COVID fund theft in the Apple Crime Blotter","Arrest made in Atlanta Apple Store shooting, a caning for an iPhone thief in Nigeria, a man accused of thefts in Canada said to wipe iPhone to cover his tracks, and more in the Apple Crime Blotter.The Apple Store at Lenox Square in AtlantaThe latest in an occ…",https://appleinsider.com/articles/20/12/06/atlanta-apple-store-shooting-arrest-covid-fund-theft-in-the-apple-crime-blotter,https://photos5.appleinsider.com/gallery/39126-74956-apple-store-xl.jpg,2020-12-06T13:02:09Z,"Arrest made in Atlanta Apple Store shooting, a caning for an iPhone thief in Nigeria, a man accused of thefts in Canada said to wipe iPhone to cover his tracks, and more in the Apple Crime Blotter. … [+5391 chars]"
"{'id': None, 'name': '9to5Mac'}",Chance Miller,"This week’s top stories: Apple Music Replay and Spotify Wrapped, 2021 Mac lineup, more","In this week’s top stories: Apple Music Replay and Spotify Wrapped go viral, 2021 rumors about mini LED, the App Store Small Business Program, and more. Read on for all of this week’s top stories. 
 Read more
The post This week’s top stories: Apple Music Repl…",https://9to5mac.com/2020/12/06/top-stories-apple-music-spotify-more/,https://i2.wp.com/9to5mac.com/wp-content/uploads/sites/6/2019/03/top-stories-header-steeber.jpg?resize=1200%2C628&quality=82&strip=all&ssl=1,2020-12-06T19:54:12Z,"In this week’s top stories: Apple Music Replay and Spotify Wrapped go viral, 2021 rumors about mini LED, the App Store Small Business Program, and more. Read on for all of this week’s top stories. 
… [+6133 chars]"
"{'id': None, 'name': 'Sneak.berlin'}",,"Macs with T2, M1 chips cannot be restored to factory state without Apple",The personal website of Jeffrey Paul.,https://sneak.berlin/20201204/on-trusting-macintosh-hardware/,,2020-12-06T04:32:31Z,"Modern Apple computers can no longer be fully used and maintained in 100% offline environments, or in ways that will reasonably ensure that the computer is free of state-ordered tampering.
Buy a new… [+9682 chars]"
"{'id': None, 'name': 'Slashdot.org'}",EditorDavid,Should Qualcomm Feel Threatened By Apple's M1 Macs?,"PCMag.com's lead mobile analyst calls Qualcomm ""a little too unbothered by Apple's M1 Macs""

Qualcomm executives brushed off a question about Apple's new M1-based Macs during a question-and-answer session at the company's Snapdragon Summit today, where Qualco…",https://hardware.slashdot.org/story/20/12/06/060238/should-qualcomm-feel-threatened-by-apples-m1-macs,https://a.fsdn.com/sd/topics/mac_64.png,2020-12-06T08:34:00Z,"Qualcomm executives brushed off a question about Apple's new M1-based Macs during a question-and-answer session at the company's Snapdragon Summit today, where Qualcomm announced a new flagship smart… [+1487 chars]"
"{'id': None, 'name': 'Digital Trends'}",John Velasco,The Wyze Watch exposes the one major problem I have with smartwatches,"Smartwatches have so many features and uses, but the Wyze Watch presents itself as an interesting alternative. In fact, it exposes a problem with smartwatches.",https://www.digitaltrends.com/home/wyze-watch-exposes-smartwatch-major-problem-opinion/,https://icdn4.digitaltrends.com/image/digitaltrends/wyze-watch-1200x630-c-ar1.91.jpg,2020-12-06T14:00:45Z,"If there’s one company that caught my attention this year far more than any other, it has to be Wyze. The Seattle-based company has been just relentless of late when it comes to new products, with it… [+3068 chars]"
"{'id': None, 'name': 'Lifehacker.jp'}",春野ユリ,M1 Mac対応のアプリを探せるWebサイトが誕生！ MacBookユーザーは早速チェック,ユーザーが新しいM1チップを搭載したMacで実行できるソフトウェアを確認できるように、プログラマのAbdullah Diaaさんが「Is Apple Silicon Ready?」という便利なWebサイトを作成しました。,https://www.lifehacker.jp/2020/12/use-this-website-to-see-what-software-runs-on-m1-macs.html,https://assets.media-platform.com/lifehacker/dist/images/2020/11/26/M11-w960.png,2020-12-06T11:00:00Z,"AppleMacIntelM1
IntelM1 Mac
Rosetta 2
InDesignIllustratorAdobeCreative Suite
M1MacAbdullah DiaaIs Apple Silicon Ready?Web
M1Mac
Screenshot: Brendan Hesse
M1Rosetta 2
Rosetta 2
M1
M1
Image:… [+83 chars]"
"{'id': None, 'name': 'AppleInsider'}",news@appleinsider.com (Malcolm Owen),How to use Enhanced Recordings and Smart Folders in Voice Memos for macOS Big Sur,"Apple introduced a number of changes to Voice Memos in macOS Big Sur, including Enhanced Recording and Smart Folders. Here's how to get to grips with the latest add-ons to the memo-recording software.Voice Memos in macOS Big SurAs part of the shift towards Ma…",https://appleinsider.com/articles/20/12/06/how-to-use-enhanced-recordings-and-smart-folders-in-voice-memos-for-macos-big-sur,https://photos5.appleinsider.com/gallery/39184-74967-voice-memos-macos-big-sur-xl.jpg,2020-12-06T23:30:02Z,"Apple introduced a number of changes to Voice Memos in macOS Big Sur, including Enhanced Recording and Smart Folders. Here's how to get to grips with the latest add-ons to the memo-recording software… [+4359 chars]"
"{'id': None, 'name': 'AppleInsider'}",news@appleinsider.com (Malcolm Owen),New EU rules may change how Apple promotes own apps in App Store,"Apple and other tech giants may have to alter how they promote their own apps on platforms they control, with the EU competition head hinting at rule changes that could be revealed before the end of 2020.The European Union is working on updating the Digital S…",https://appleinsider.com/articles/20/12/06/new-eu-rules-may-change-how-apple-promotes-own-apps-in-app-store,https://photos5.appleinsider.com/gallery/39182-74959-36715-68590-European-Commission-xl-xl.jpg,2020-12-06T16:46:12Z,"Apple and other tech giants may have to alter how they promote their own apps on platforms they control, with the EU competition head hinting at rule changes that could be revealed before the end of … [+2310 chars]"
"{'id': 'engadget', 'name': 'Engadget'}",山根博士 (Yasuhiro Yamane),4000円台のスマートウォッチ、シャオミやZTEなどから登場（山根博士）,スマートフォンの高性能化が進む一方で、低価格なスマートフォンの性能もここ数年で格段に高まりました。スマートウォッチの世界も同様に、来年は低価格モデルが次々と出てきそうです…,https://japanese.engadget.com/apple-watch-4000-020221021.html,https://s.yimg.com/os/creatr-uploaded-images/2020-12/5fd62c21-3394-11eb-b66f-89a93d8f8950,2020-12-06T02:02:21Z,"Redmi Note 9S2480048008005002006.675000mAh
4000
ZTEZTE Watch Live1.32402402151IP68
ZTE Watch Live
Apple WatchZTE Watch LiveApple Watch
ZTE Watch Live
ZTE Watch Live40.634.610.8mm35.7g2494000400… [+377 chars]"
"{'id': None, 'name': 'AppleInsider'}",news@appleinsider.com (Wesley Hilliard),Review: Keychron K1 is the wireless keyboard Apple should have made,Users familiar with the Apple Magic Keyboard will fall in love with the Keychron K1 with its slim design and comfortable typing experience.The Keychron K1v4 is a slim mechanical keyboard with a great designKeychron is a popular mechanical keyboard manufacture…,https://appleinsider.com/articles/20/12/06/review-keychron-k1-is-the-wireless-keyboard-apple-should-have-made,https://photos5.appleinsider.com/gallery/39118-74816-Keychron-K1-xl.jpg,2020-12-06T22:04:36Z,"Users familiar with the Apple Magic Keyboard will fall in love with the Keychron K1 with its slim design and comfortable typing experience.
Keychron is a popular mechanical keyboard manufacturer wit… [+4836 chars]"
"{'id': None, 'name': 'Android Central'}",John Levite,Watch your favorite shows on Samsung's 55-inch 4K Smart TV down to $350,"The Samsung UN55NU6900FXZA 55-inch 4K Smart TV is down to $349.99 at Best Buy. That's $50 off its regular price, and it's still going for that $400 price at some other retailers like Target. While this is an older TV from 2018, the screen still has a lot of g…",https://www.androidcentral.com/watch-your-favorite-shows-samsungs-55-inch-4k-smart-tv-down-350-today,https://www.androidcentral.com/sites/androidcentral.com/files/styles/large/public/article_images/2020/12/samsung-55-tizen.jpg,2020-12-06T15:31:49Z,"The Samsung UN55NU6900FXZA 55-inch 4K Smart TV is down to $349.99 at Best Buy. That's $50 off its regular price, and it's still going for that $400 price at some other retailers like Target. While th… [+2070 chars]"
"{'id': None, 'name': 'HYPEBEAST'}","info@hypebeast.com (HYPEBEAST), HYPEBEAST",Apple Will Repair Your Glitchy iPhone 11 Display for Free,"After last month's announcement that Apple would replace buggy pairs of AirPods Pro, the company has announced a similar program for an iPhone 11 glitch affecting displays. Apple has launched the iPhone 11 Display Module Replacement Program for Touch Issues f…",https://hypebeast.com/2020/12/apple-iphone-11-free-replacement-display-touchscreen-glitch-repair,https://image-cdn.hypb.st/https%3A%2F%2Fhypebeast.com%2Fimage%2F2020%2F12%2Fapple-iphone-11-free-replacement-display-touchscreen-glitch-repair2.jpg?w=960&cbr=1&q=90&fit=max,2020-12-06T17:38:22Z,"After last month’s announcement that Apple would replace buggy pairs of AirPods Pro, the company has announced a similar program for an iPhone 11 glitch affecting displays. 
Apple has launched the i… [+929 chars]"
"{'id': None, 'name': 'Entrepreneur'}",Entrepreneur Store,Secure Your Business Communications With These Privacy Apps,Score a great deal on ZenMate VPN and StartMail Private Email Service.,https://www.entrepreneur.com/article/360937,https://assets.entrepreneur.com/content/3x2/2000/1607059494-glenn-carstens-peters-npxXWgQ33ZQ-unsplash1.jpg,2020-12-06T15:00:00Z,"December
6, 2020
2 min read
Disclosure: Our goal is to feature products and services that we think you'll find interesting and useful. If you purchase them, Entrepreneur may get a small share of t… [+1977 chars]"
"{'id': 'engadget', 'name': 'Engadget'}",Kiyoshi Tane,将来マットブラックのMacBookやApple Watchが登場？アップルが特許出願,アップルがiPhoneやiPad、Apple WatchやMacBookなど、様々な製品をマットブラック（ツヤ消しの黒）仕上げにできる特許を出願したことが明らかとなりました。,https://japanese.engadget.com/matteblack-macbook-apple-patent-213521300.html,https://s.yimg.com/os/creatr-uploaded-images/2020-12/8443d010-37bf-11eb-97ff-02d43e68af91,2020-12-06T21:35:21Z,
"{'id': None, 'name': 'AppleInsider'}",news@appleinsider.com (Malcolm Owen),Clear Macintosh Classic prototype surfaces on Twitter,"A prototype version of the Macintosh Classic has surfaced on Twitter, with images showing the antique Mac in an unusual completely clear enclosure.The Macintosh Classic with a clear casing [@DongleBookPro]The Macintosh Classic is a familiar vintage computer t…",https://appleinsider.com/articles/20/12/06/clear-macintosh-classic-prototype-surfaces-on-twitter,https://photos5.appleinsider.com/gallery/39183-74960-clear-macintosh-classic-xl.jpg,2020-12-06T18:30:55Z,"A prototype version of the Macintosh Classic has surfaced on Twitter, with images showing the antique Mac in an unusual completely clear enclosure. 
The Macintosh Classic is a familiar vintage compu… [+1619 chars]"
"{'id': None, 'name': 'The Indian Express'}",Express News Service,Gujarat: Man booked for FB posts supporting farmers’ agitation,"According to police, the accused Shailesh Parmar, a resident of Vadodara, has been booked on Sunday at Khambat city police station for running a Facebook page “Khambat ki Shaan”, with various “incendiary posts”.",https://indianexpress.com/article/india/gujarat-man-booked-for-fb-posts-supporting-farmers-agitation-7094556/,https://images.indianexpress.com/2020/12/fb-post.jpg,2020-12-06T22:03:26Z,"The accused has been booked. (Representational)Police booked a man in Anand over his posts on Facebook, in support of the ongoing farmers agitation in New Delhi, for allegedly attempting to disrupt n… [+751 chars]"
"{'id': None, 'name': 'Tinhte.vn'}","vuphanhoanglinh@gmail.com (_vphlinh_), _vphlinh_","App giả danh Bộ Công an, anh em cảnh giác kẻo tiền mất tật mang","Page FB “Thông tin Chính phủ” (page xịn, có tick xanh) đã có bài cảnh báo về app giả danh có tên “Bộ Công an” bỗng rộ lên thời gian gần đây. Anh em theo dõi và thông báo với mọi người để nâng cao...",https://tinhte.vn/thread/app-gia-danh-bo-cong-an-anh-em-canh-giac-keo-tien-mat-tat-mang.3233265/,https://photo2.tinhte.vn/data/attachment-files/2020/12/5250585_cover_app.jpg,2020-12-06T13:23:53Z,"Sau khi nn nhân cài t App mang tên B Công an nói trên, theo hng dn ca các i tng, nn nhân s phi in thêm các trng thông tin hin th trên App gi mo này nh: tên ng nhp, mt khu, tài khon ngân hàng, h tên, … [+2455 chars]"
"{'id': None, 'name': 'Itmedia.co.jp'}",�q�i�^�J�C�˂Ƃ��,騒音おばさんがモチーフの映画「ミセス・ノイズィ」がまさかの大傑作だった,�������΂����`�[�t�̉f��u�~�Z�X�E�m�C�Y�B�v�̖��͂�l�^�o���Ȃ��ŏЉ��B,https://nlab.itmedia.co.jp/nl/articles/2012/06/news010.html,https://image.itmedia.co.jp/nl/articles/2012/06/cover_news010.jpg,2020-12-06T02:30:00Z,"@124Afu~ZXEmCYBvJB
@{`[tAyoAuvOL2005NQBA^AtBNVIWiXg[[B
@ufvRZvgAgl^hvBAu~ZXEmCYBvAlIIjijA2020N{fwxAl^vAB
@A{l^oBu\mvAuJ~IvuhXelvBAufAHvxA{yB
@Au~ZXEmCYBv\mAAXgbvBmFAfBjSIl^oA{dvgd|hCt\BKB
1F… [+335 chars]"
"{'id': None, 'name': 'Impress.co.jp'}",,GeForce RTX 3060 Ti、オリジナルクーラー搭載Radeon RX 6800、LG WING、ピラミッド風PCケース、micro:bit V2、VTuber「フミ」コラボすのこタン。 ほか 秋葉原の気になるニュース（11月30日～12月6日分）,先週の気になる記事をピックアップ。,https://akiba-pc.watch.impress.co.jp/docs/news/news/1293346.html,https://akiba-pc.watch.impress.co.jp/img/ah/list/1293/346/mpal3060ti1.jpg,2020-12-06T23:05:00Z,"NVIDIAGeForce RTX 3060 Ti54,780
 GeForce RTX 30GeForce RTX 3060 Ti12354,78072,480
Radeon RX 6800419
 Radeon RX 680012419Radeon RX 6800 XT1Radeon RX 6800387,978112,200
T2LG WING
 LG2LG WINGLM-F10… [+711 chars]"
"{'id': None, 'name': 'Kocpc.com.tw'}",Rocky,如何查看過往 Facebook 按讚互動、留言、被標註的動態活動記錄？快速找出你要的內容,"使用 Facebook 的過程中，多少都會碰到想要找以前曾經按過某個動態讚、留過留言、甚至是被人標註的相片之類，被標註的好處理，一直滑動態應該就能找到，但如果是朋友的某則動態，就有點困難，甚至忘記是在哪一個朋友 FB 看到。事實上 Facebook 有內建所謂的 “活動紀錄” 功能，不僅會詳細記錄你在 Facebook 上的所有活動（如：曾互動、留言、標註、社團動態、聯繫對象等等），還提供強大的過濾器，可依自己需求設定，輕輕鬆鬆快速找到想要的內容，下面就來教你如何使用。
這篇文章 如何查看過往 Facebook …",https://www.kocpc.com.tw/archives/359602,https://i0.zi.org.tw/kocpc/2020/12/1607241693-e04ed439d1d90ec2fae967b2fe5fc3be.jpg,2020-12-06T08:03:33Z,"Facebook FB Facebook Facebook 
Facebook iOS Android iOS 
 Facebook App ” 
 FB 
Facebook 
Facebook iOS"
