source,author,title,description,url,urlToImage,publishedAt,content
"{'id': 'the-next-web', 'name': 'The Next Web'}",Abhimanyu Ghoshal,Google services are down right now,"Yup, it’s not just you — many Google services, including search, Gmail, G Suite, and YouTube are unavailable across many countries around the world right now. The cause of the outage is presently unclear. We’ll update this post as we learn more. The company’s…",https://thenextweb.com/plugged/2020/12/14/google-services-are-down-right-now-thats-2020-for-you/,https://img-cdn.tnwcdn.com/image/plugged?filter_last=1&fit=1280%2C640&url=https%3A%2F%2Fcdn0.tnwcdn.com%2Fwp-content%2Fblogs.dir%2F1%2Ffiles%2F2020%2F12%2FGoogle-is-down.jpg&signature=0efdbe39cca21cd25466748d8ab683f3,2020-12-14T11:59:58Z,"Update (5:36PM IST/1:06PM CET):Google Search is up and running now. Other services are still down.
Yup, its not just you many Google services, including Gmail, G Suite, and YouTube are unavailable a… [+597 chars]"
"{'id': None, 'name': 'Blog.google'}",Mark ReganProduct ManagerGoogle Assistant,How to host a group video call to celebrate the holidays,"This is the first year I won’t be celebrating the holidays in-person with family. I’ll be with my wife and young son, and like so many others, we plan on hosting a group video call to virtually “get together” with family and friends spread out across Ireland …",https://blog.google/products/assistant/how-host-group-video-call-celebrate-holidays/?utm_source=feedburner&utm_medium=feed&utm_campaign=Feed%3A+blogspot%2FMKuf+%28The+Keyword+%7C+Official+Google+Blog%29,https://storage.googleapis.com/gweb-uniblog-publish-prod/images/Assistant_video_calling_holiday.max-1300x1300.png,2020-12-14T17:00:00Z,"This is the first year I wont be celebrating the holidays in-person with family. Ill be with my wife and young son, and like so many others, we plan on hosting a group video call to virtually get tog… [+2681 chars]"
"{'id': None, 'name': 'MacRumors'}",Tim Hardwick,"Gmail, YouTube, and Google Docs All Currently Down in Several Countries","Gmail, YouTube and Google Docs are all experiencing severe outages, with reports of problems accessing the services across much of Europe, the U.S. and India. 





It's not clear right now what's causing the issues, but the DownDetector website indicates tha…",https://www.macrumors.com/2020/12/14/gmail-youtube-and-google-docs-currently-down/,https://images.macrumors.com/t/JlO_AK01yuB-Tl1sIEEU5XpMl3g=/1600x/https://images.macrumors.com/article-new/2020/12/youtube-down.jpg,2020-12-14T12:10:12Z,"Gmail, YouTube and Google Docs are all experiencing severe outages, with reports of problems accessing the services across much of Europe, the U.S. and India. 
Google News, Google Translate, Google … [+533 chars]"
"{'id': None, 'name': 'CNET'}",Katie Collins,"Gmail, YouTube down: Google services back online after widespread outage - CNET",Not a great start to the week for the big G.,https://www.cnet.com/news/gmail-youtube-down-google-services-back-online-after-widespread-outage/,https://cnet4.cbsistatic.com/img/dnJfa-pkWajMq4Z-31TZ4C29qRA=/1200x630/2020/12/14/b5afb237-ce06-4316-9f07-0d03fa875477/screen-shot-2020-12-14-at-12-13-40.png,2020-12-14T13:07:00Z,"Google services are down around the world.
DownDetector/Screenshot
Google services suffered a widespread outage that lasted over an hour on Monday, as users around the world complained that they co… [+1369 chars]"
