source,author,title,description,url,urlToImage,publishedAt,content
"{'id': None, 'name': ""CP24 Toronto's Breaking News""}",,"COVID-19 cases in Canada remain on troubling course, Tam says, amid rising numbers - CP24 Toronto's Breaking News","COVID-19 cases in Canada remain on troubling course, Tam says, amid rising numbers  CP24 Toronto's Breaking NewsView Full coverage on Google News",https://www.cp24.com/news/covid-19-cases-in-canada-remain-on-troubling-course-tam-says-amid-rising-numbers-1.5208924,https://www.cp24.com/polopoly_fs/1.5208929.1606607419!/httpImage/image.jpg_gen/derivatives/landscape_620/image.jpg,2020-11-28T23:50:00Z,"Canada remains on a troubling path for new COVID-19 infections as case counts continue to mount, the country's top doctor said Saturday.
The most recent infection rates indicate Canada is on track t… [+3726 chars]"
"{'id': None, 'name': 'Ctvnews.ca'}","Ian Holliday, Ian Holliday","Publicly funded COVID-19 tests in B.C. come back positive more often, data shows - CTV News Vancouver","Publicly funded COVID-19 tests in B.C. come back positive more often, data shows  CTV News VancouverView Full coverage on Google News",https://bc.ctvnews.ca/publicly-funded-covid-19-tests-in-b-c-come-back-positive-more-often-data-shows-1.5208830,https://www.ctvnews.ca/polopoly_fs/1.4864345.1584977886!/httpImage/image.jpg_gen/derivatives/landscape_620/image.jpg,2020-11-28T22:30:00Z,"VANCOUVER -- 
As COVID-19 cases in B.C. have surged, so has the percentage of tests for the coronavirus that are coming back positive.
While this correlation is not surprising, a change to the way … [+3088 chars]"
