source,author,title,description,url,urlToImage,publishedAt,content
"{'id': 'bbc-news', 'name': 'BBC News'}",BBC News,Covid: US House votes to boost stimulus package payments,"The chamber backs President Trump's call for $2,000 payments but the move could stall in the Senate.",http://www.bbc.co.uk/news/world-us-canada-55471647,https://ichef.bbci.co.uk/news/1024/branded_news/DE88/production/_116286965_gettyimages-1230097453.jpg,2020-12-29T02:37:22.8665351Z,"image copyrightGetty Images
image captionThe pandemic has devastated the US economy and caused a surge in unemployment
The US House of Representatives has voted in favour of increasing the aid sent… [+3075 chars]"
"{'id': 'bbc-news', 'name': 'BBC News'}",BBC News,When online meetings didn’t go as planned,"From animal interruptions to catching fire, here's a look back at the year we spent (badly) online.",http://www.bbc.co.uk/news/world-55375825,https://ichef.bbci.co.uk/images/ic/400xn/p092mw4b.jpg,2020-12-29T00:22:24.3846859Z,"2020 was the year everything went online. From virtual meetings and teaching online to socialising on a screen, a lot of us have spent a lot of time logged in.
But with interruptions from pets and c… [+197 chars]"
"{'id': 'bbc-news', 'name': 'BBC News'}",BBC News,Coronavirus: Spain to keep registry of those who refuse Covid vaccine,"Vaccination will not be mandatory, officials say, and the register will not be made public.",http://www.bbc.co.uk/news/world-europe-55471282,https://ichef.bbci.co.uk/news/1024/branded_news/E144/production/_116286675_064969673.jpg,2020-12-29T00:22:20.541892Z,"image captionThe elderly are among those receiving the first wave of vaccinations in Spain
Spain is to set up a registry of people who refuse to be vaccinated against coronavirus and share it with o… [+2052 chars]"
"{'id': 'bbc-news', 'name': 'BBC News'}",BBC News,Nashville explosion: Motives still unclear in Nashville 'suicide bomb',Investigators are trying to work out the motive behind the Christmas Day blast that injured three.,http://www.bbc.co.uk/news/world-us-canada-55468759,https://ichef.bbci.co.uk/news/1024/branded_news/11A22/production/_116262227_35c1f445-9ede-4644-94ff-6376ad96a1df.jpg,2020-12-28T22:52:22.2325734Z,"media captionWatch the aftermath of the explosion in Nashville
US investigators are trying to find out why a 63-year-old computer consultant detonated a bomb that killed himself and injured three ot… [+2705 chars]"
"{'id': 'bbc-news', 'name': 'BBC News'}",BBC News,Joe Biden: 'Enormous damage' to US security agencies by Trump,The president-elect says his team is not getting the information it needs on national security.,http://www.bbc.co.uk/news/world-us-canada-55470625,https://ichef.bbci.co.uk/news/1024/branded_news/5F94/production/_116286442_064981892-1.jpg,2020-12-28T22:22:22.5033425Z,"Agencies critical to US security have suffered ""enormous damage"" at the hands of the Trump administration, US President-elect Joe Biden has said.
Mr Biden said his team was not getting the informati… [+1946 chars]"
"{'id': 'bbc-news', 'name': 'BBC News'}",BBC News,Covid: South Africa's Ramaphosa announces new restrictions as cases soar,"The measures include a ban on indoor and outdoor gatherings, and a night curfew, until 15 January.",http://www.bbc.co.uk/news/world-africa-55468104,https://ichef.bbci.co.uk/news/1024/branded_news/D4EC/production/_116280545_mediaitem116280544.jpg,2020-12-28T19:22:21.2057413Z,"image captionMr Ramaphosa said the country had let its guard down
President Cyril Ramaphosa has announced new tougher coronavirus restrictions, a day after South Africa recorded more than one millio… [+2585 chars]"
"{'id': 'bbc-news', 'name': 'BBC News'}",BBC News,Hilaria Baldwin denies faking her Spanish heritage,The wife of Alec Baldwin has been accused of misleading the public over her Spanish heritage.,http://www.bbc.co.uk/news/world-us-canada-55468754,https://ichef.bbci.co.uk/news/1024/branded_news/14922/production/_116285248_mediaitem116285244.jpg,2020-12-28T17:22:21.0407189Z,"image copyrightGetty Images
image captionThe TV host has been accused of faking a Spanish accent
Hilaria Baldwin, TV host and wife of actor Alec Baldwin, has responded to accusations she misled the… [+1797 chars]"
"{'id': 'bbc-news', 'name': 'BBC News'}",BBC News,Covid-19: Concern at 'unprecedented' infection level in England,"The UK reports a further 41,385 cases as hospitals struggle to cope with rising patient numbers.",http://www.bbc.co.uk/news/uk-55462701,https://ichef.bbci.co.uk/news/1024/branded_news/7889/production/_116275803_mediaitem116275477.jpg,2020-12-28T17:07:19.8638005Z,"England's ""very high"" Covid infection level is a ""growing concern"" as the NHS struggles to cope with rising patient numbers, a health official has said.
On Monday, a further 41,385 Covid cases and 3… [+5504 chars]"
"{'id': 'bbc-news', 'name': 'BBC News'}",BBC News,Loujain al-Hathloul: Saudi woman activist jailed for five years,"Loujain al-Hathloul, 31, was prominent in the campaign to win the right for Saudi women to drive.",http://www.bbc.co.uk/news/world-middle-east-55467414,https://ichef.bbci.co.uk/news/1024/branded_news/113E0/production/_115242607_mediaitem115237706.jpg,2020-12-28T13:07:20.5474276Z,"image captionLoujain al-Hathloul was detained in 2018
A prominent Saudi female activist, who campaigned for women's right to drive, has been sentenced to more than five years in prison. 
Loujain al… [+2032 chars]"
"{'id': 'bbc-news', 'name': 'BBC News'}",BBC News,Brexit: Britons warned to prepare for 'some disruption',"Ministers warn of ""practical and procedural changes"" when the Brexit transition period ends this week.",http://www.bbc.co.uk/news/uk-55463506,https://ichef.bbci.co.uk/news/1024/branded_news/EDB9/production/_116275806_mediaitem116275805.jpg,2020-12-28T07:52:23.5254222Z,"Businesses and travellers should get ready for ""substantial"" change from New Year's Eve, when the UK leaves the EU, the government has said.
Cabinet Office Minister Michael Gove said there would be … [+3900 chars]"
"{'id': 'techcrunch', 'name': 'TechCrunch'}",Anthony Ha,Daily Crunch: Apple launches Fitness+,"We review Apple Fitness+, Gmail goes down and Pornhub cracks down on unverified content. This is your Daily Crunch for December 14, 2020. The big story: Apple launches Fitness+ Brian Heater tried out Apple’s new $10-per-month subscription service for guided w…",http://techcrunch.com/2020/12/14/daily-crunch-apple-launches-fitness/,https://techcrunch.com/wp-content/uploads/2020/12/2020-12-11-030753165.jpg?w=533,2020-12-14T23:08:16Z,"We review Apple Fitness+, Gmail goes down and Pornhub cracks down on unverified content. This is your Daily Crunch for December 14, 2020.
The big story: Apple launches Fitness+
Brian Heater tried o… [+2872 chars]"
"{'id': 'wired', 'name': 'Wired'}","Parker Hall, Gear Team","20 Great Green Monday Deals on Apple, Bose, Sonos, and More","Whether you've heard of Green Monday or not, you should check out these holiday tech deals from Apple, Amazon, Sonos, Bose, Sony, and more.",https://www.wired.com/story/green-monday-deals-2020/,"https://media.wired.com/photos/5fd694b03df9cf7176d399eb/191:100/w_1280,c_limit/GEAR-Vizio-P-Series-Quantum-SOURCE-Vizio.jpg",2020-12-14T12:00:00Z,"<li>Apple Watch Series 62020 Versionfor $350 ($49 off): The latest Apple Watch is still our favorite smartwatch, and it's only $20 more than its Cyber Monday price right now, so it's a good time to g… [+1607 chars]"
"{'id': 'engadget', 'name': 'Engadget'}",Nicole Lee,Apple Watch can now warn if your cardio fitness is low,"The latest iOS 14.3 and watchOS 7.2 updates have introduced a new way to measure your health, specifically your cardio fitness level. Not only can Apple Watch users now view their cardio fitness level in the Health app, they’ll also receive a notification if …",https://www.engadget.com/apple-watch-cardio-fitness-193054730.html,https://o.aolcdn.com/images/dims?resize=1200%2C630&crop=1200%2C630%2C0%2C0&quality=95&image_uri=https%3A%2F%2Fs.yimg.com%2Fos%2Fcreatr-uploaded-images%2F2020-12%2F44022640-3e41-11eb-9eb8-5f69878c3ef7&client=amp-blogside-v2&signature=3546f24ef628ea219a236e94e594a5ea1f9b3118,2020-12-14T19:30:54Z,"This latest watchOS 7.2 update, however, can also tell you what your cardio fitness is at the low levels, without the need for exercise. According to Apple, the Watch will use multiple sensors such a… [+1090 chars]"
"{'id': None, 'name': 'Gizmodo.com'}",Sam Rutherford,"Fitness+, a New RAW Format and More Just Launched with iOS 14.3","In an attempt to push one more iPhone and iPad update out before the end of the year, today Apple released iOS and iPad OS 14.3. Fitness+ is now live.Read more...",https://gizmodo.com/fitness-a-new-raw-format-and-more-just-launched-with-1845879986,"https://i.kinja-img.com/gawker-media/image/upload/c_fill,f_auto,fl_progressive,g_center,h_675,pg_1,q_80,w_1200/u6au2nfnoogzem40kbpk.jpg",2020-12-14T20:16:00Z,"In an attempt to push one more iPhone and iPad update out before the end of the year, today Apple released iOS and iPad OS 14.3. Fitness+ is now live.
While the general interface and performance of … [+2259 chars]"
"{'id': None, 'name': 'Gizmodo.com'}",Victoria Song,"Surprise, Surprise: Tim Cook Killed an Apple TV+ Show About Gawker","Surprising absolutely no one, Tim Cook is not a fan of now-dead Gawker Media, of which Gizmodo was a part. And though Gawker has been dead since 2016, it appears that Cook also decided to kill a fictional Gawker by pulling the plug on a proposed Apple TV+ sho…",https://gizmodo.com/surprise-surprise-tim-cook-killed-an-apple-tv-show-a-1845876497,"https://i.kinja-img.com/gawker-media/image/upload/c_fill,f_auto,fl_progressive,g_center,h_675,pg_1,q_80,w_1200/jb1ypc8dpxmdobfkqjfu.jpg",2020-12-14T17:40:00Z,"Surprising absolutely no one, Tim Cook is not a fan of now-dead Gawker Media, of which Gizmodo was a part. And though Gawker has been dead since 2016, it appears that Cook also decided to kill a fict… [+3154 chars]"
"{'id': None, 'name': 'MacRumors'}",Juli Clover,Apple Fitness+ Works on iPhone and iPad Without an Apple Watch,"Apple designed the new Fitness+ service to work with a paired Apple Watch as the Apple Watch is meant to allow you to track your metrics while you follow along on a workout, but as it turns out, an Apple Watch isn't strictly necessary to use the Fitness+ app …",https://www.macrumors.com/2020/12/14/apple-fitness-plus-iphone-ipad-no-watch/,https://images.macrumors.com/t/ou0zg1H5fjA2zhVjL5uqSKhLgW8=/2000x/https://images.macrumors.com/article-new/2020/12/fitness-plus-workout-without-watch.jpg,2020-12-14T21:26:40Z,"Apple designed the new Fitness+ service to work with a paired Apple Watch as the Apple Watch is meant to allow you to track your metrics while you follow along on a workout, but as it turns out, an A… [+865 chars]"
"{'id': None, 'name': 'MacRumors'}",Juli Clover,How to Start Workouts In Apple Fitness+,"Apple Fitness+ is Apple's latest subscription service, offering home workout options for Apple Watch users across a range of different fitness categories like yoga, cycling, running, core, and more.



The Fitness+ service is designed to work with an Apple Wa…",https://www.macrumors.com/how-to/start-workouts-apple-fitness-plus/,https://images.macrumors.com/t/BTfzet0T5mjHX-MRIXw15IOxx-A=/1600x/https://images.macrumors.com/article-new/2020/12/apple-fitness-plus-workout.jpg,2020-12-14T21:49:38Z,"Apple Fitness+ is Apple's latest subscription service, offering home workout options for Apple Watch users across a range of different fitness categories like yoga, cycling, running, core, and more.… [+2051 chars]"
"{'id': None, 'name': 'MacRumors'}",Juli Clover,My Best Buy Members With Apple Watches Purchased Before September 15 Eligible for Extra Free Month of Fitness+,"Best Buy has teamed up with Apple for several Fitness+ trial exclusives, which offer extended access to Apple Watch owners who are also Best Buy customers.





Customers who purchased an Apple Watch Series 3, Series 6, or SE from Best Buy after on or after S…",https://www.macrumors.com/2020/12/14/best-buy-extra-free-month/,https://images.macrumors.com/t/yl5FLVf6xzm601zzroYpBrGdsZk=/1600x/https://images.macrumors.com/article-new/2020/09/applefitnesswatchandiphone.jpg,2020-12-14T22:26:02Z,"Best Buy has teamed up with Apple for several Fitness+ trial exclusives, which offer extended access to Apple Watch owners who are also Best Buy customers.
Customers who purchased an Apple Watch Ser… [+914 chars]"
"{'id': None, 'name': 'MacRumors'}",Juli Clover,Apple Website Highlights Workout Equipment Used in Fitness+ Videos,"With the launch of Apple Fitness+, Apple now has a section on its workout for Fitness+ equipment, which offers links to buy the workout items that are used in Fitness+ videos.





Many of the Fitness+ workouts are designed to work with no equipment at all, b…",https://www.macrumors.com/2020/12/14/apple-fitness-plus-workout-equipment/,https://images.macrumors.com/t/_80uo-tHas1oU8fjQG2on8HR6wE=/1600x/https://images.macrumors.com/article-new/2020/12/yoga-block-manduka.jpeg,2020-12-14T22:34:50Z,"With the launch of Apple Fitness+, Apple now has a section on its workout for Fitness+ equipment, which offers links to buy the workout items that are used in Fitness+ videos.
Many of the Fitness+ w… [+1100 chars]"
"{'id': None, 'name': 'MacRumors'}",Joe Rossignol,Apple Fitness+ Launches Today: Worthy Alternative to Peloton for Apple Watch Users,"Apple's new Fitness+ workout service launches later today, and ahead of time, some media outlets and YouTube channels have shared their first impressions of the platform. We've gathered up some opinions and videos below.



CNET's Vanessa Hand Orellana trying…",https://www.macrumors.com/2020/12/14/apple-fitness-plus-reviews/,https://images.macrumors.com/t/OyyUQkZjYyKgQa_rw0UT_63y0rg=/1600x/https://images.macrumors.com/article-new/2020/12/apple-fitness-plus-cnet.jpg,2020-12-14T14:55:34Z,"Apple's new Fitness+ workout service launches later today, and ahead of time, some media outlets and YouTube channels have shared their first impressions of the platform. We've gathered up some opini… [+3678 chars]"
"{'id': None, 'name': 'MacRumors'}",Tim Hardwick,Report: Apple TV+ Show Based on Gawker Media Got Scrapped After Tim Cook Intervened,"An Apple TV+ series chronicling the rise of controversial blogging network Gawker Media was reportedly canned after Tim Cook learned about the project and intervened, according to a new report.





Earlier this year, Vanity Fair claimed Apple was in the earl…",https://www.macrumors.com/2020/12/14/tim-cook-killed-off-gawker-apple-tv-plus-show/,https://images.macrumors.com/t/zfYLIz80q4SFXuDnAuwqopbyxqQ=/1600x/http://images.macrumors.com/article-new/2017/09/ap_keynote_2017_wrap_up_tim_cook.jpg,2020-12-14T11:01:07Z,"An Apple TV+ series chronicling the rise of controversial blogging network Gawker Media was reportedly canned after Tim Cook learned about the project and intervened, according to a new report.
Earl… [+2152 chars]"
"{'id': None, 'name': 'MacRumors'}",Juli Clover,"Apple Launches Fitness+, Three-Month Free Trial Now Available for New Apple Watch Owners","When introducing the Apple Watch Series 6 in September, Apple unveiled a new Fitness+ workout service, which is finally launching as of today alongside the iOS and iPadOS 14.3 updates.





Priced at $9.99 per month or $79.99 per year and also included in the…",https://www.macrumors.com/2020/12/14/apple-launches-fitness-plus/,https://images.macrumors.com/t/x1IoVwfrXKQToU8DrFtKCKvlY1c=/2250x/https://images.macrumors.com/article-new/2020/09/Apple-Fitness-Plus-Feature.jpg,2020-12-14T18:11:22Z,"When introducing the Apple Watch Series 6 in September, Apple unveiled a new Fitness+ workout service, which is finally launching as of today alongside the iOS and iPadOS 14.3 updates.
Priced at $9.… [+2169 chars]"
"{'id': None, 'name': 'Boing Boing'}",Rob Beschizza,Apple II Myst demake,"I don't have a VR headset, so can't check out the newfangled VR edition of classic exploration and puzzle game Myst from Cyan Worlds, launched last week to positive reviews. So instead I have to content myself with the Apple II Myst demake. — Read the rest",https://boingboing.net/2020/12/14/apple-ii-myst-demake.html,https://i2.wp.com/boingboing.net/wp-content/uploads/2020/12/mist_rocket.jpg?fit=356%2C295&ssl=1,2020-12-14T14:08:57Z,
"{'id': None, 'name': 'MacRumors'}",Juli Clover,Apple Fitness+ on iPad Not Yet Available,"Apple Fitness+ launched this morning for Apple Watch, iPhone, iPad, and Apple TV, but people who have been attempting to use the feature on an ‌iPad‌ have run into a hiccup.





On the ‌iPad‌, the Fitness app isn't installed automatically and must be downloa…",https://www.macrumors.com/2020/12/14/apple-fitness-plus-ipad-unavailable/,https://images.macrumors.com/t/-cetyej4hZtf7byrIjgQuVtV-yw=/2000x/https://images.macrumors.com/article-new/2020/12/apple-fitness-plus-no-ipad.jpg,2020-12-14T20:22:09Z,"Apple Fitness+ launched this morning for Apple Watch, iPhone, iPad, and Apple TV, but people who have been attempting to use the feature on an ‌iPad‌ have run into a hiccup.
On the ‌iPad‌, the Fitne… [+827 chars]"
"{'id': None, 'name': 'MacRumors'}",Juli Clover,How to Sign Up for Apple Fitness+,"With the launch of iOS 14.3, iPadOS 14.3, watchOS 7.2, and tvOS 14.3, Apple introduced its latest subscription service, Apple Fitness+. Fitness+ is designed to work with the Apple Watch, providing workouts that can be done on an iPhone, iPad, or Apple TV, wit…",https://www.macrumors.com/how-to/sign-up-for-apple-fitness-plus/,https://images.macrumors.com/t/imyR5QkTAeufS8Jtxagzbx5yMBU=/2500x/https://images.macrumors.com/article-new/2020/11/Apple-fitness-plus-feature.jpg,2020-12-14T19:47:25Z,"With the launch of iOS 14.3, iPadOS 14.3, watchOS 7.2, and tvOS 14.3, Apple introduced its latest subscription service, Apple Fitness+. Fitness+ is designed to work with the Apple Watch, providing wo… [+2166 chars]"
"{'id': None, 'name': 'MacRumors'}",Juli Clover,Apple Fitness+ Appears to Be Incompatible With AirPlay,"Apple Fitness+ is available as of today, and some customers have been wondering if it's possible to get the workout videos on a television set without an Apple TV.





There are several smart TVs from brands like LG and Sony that support AirPlay 2 content, b…",https://www.macrumors.com/2020/12/14/apple-fitness-plus-no-airplay/,https://images.macrumors.com/t/x1IoVwfrXKQToU8DrFtKCKvlY1c=/2250x/https://images.macrumors.com/article-new/2020/09/Apple-Fitness-Plus-Feature.jpg,2020-12-14T21:19:23Z,"Apple Fitness+ is available as of today, and some customers have been wondering if it's possible to get the workout videos on a television set without an Apple TV.
There are several smart TVs from b… [+717 chars]"
"{'id': None, 'name': 'MacRumors'}",Juli Clover,Life Time Health & Fitness Club Offering Apple Fitness+ as Part of Membership,"Life Time Fitness, a gym with facilities located across the United States, today announced that it is including Apple's new Fitness+ subscription service in Life Time memberships starting later this month.





Life Time customers who have a have a membership…",https://www.macrumors.com/2020/12/14/life-time-gym-free-apple-fitness-membership/,https://images.macrumors.com/t/PXFmPd-yXzFTKaUgtEQdwQPTpGk=/1808x/https://images.macrumors.com/article-new/2020/09/fitness-plus.jpg,2020-12-14T20:32:51Z,"Life Time Fitness, a gym with facilities located across the United States, today announced that it is including Apple's new Fitness+ subscription service in Life Time memberships starting later this … [+1216 chars]"
"{'id': 'reuters', 'name': 'Reuters'}","Sankalp Phartiyal, Chandini Monnappa",Apple investigating Wistron facility in India after violence - Reuters UK,"Apple Inc said it is investigating if its Taiwanese contractor Wistron Corp flouted supplier guidelines at a violence-hit iPhone manufacturing facility near the Indian city of Bengaluru, following violence at the plant.",https://uk.reuters.com/article/apple-india-wistron-idUKKBN28O0LV,https://static.reuters.com/resources/r/?m=02&d=20201214&t=2&i=1544463304&r=LYNXMPEGBD0C4&w=800,2020-12-14T07:08:00Z,NEW DELHI/BENGALURU (Reuters) - Apple Inc said it is investigating if its Taiwanese contractor Wistron Corp flouted supplier guidelines at a violence-hit iPhone manufacturing facility near the Indian… [+1728 chars]
"{'id': 'reuters', 'name': 'Reuters'}",Reuters Staff,Apple starts applying new data privacy labels to apps - Reuters,Apple Inc on Monday said it had begun the rollout of new labels about the privacy practices of apps for users to see before they are downloaded from its App Store.,https://www.reuters.com/article/us-apple-privacy-idUSKBN28O2KQ,https://static.reuters.com/resources/r/?m=02&d=20201214&t=2&i=1544536511&r=LYNXMPEGBD1GE&w=800,2020-12-14T18:12:00Z,"By Reuters Staff
FILE PHOTO: The Apple logo is seen at an Apple Store, as Apple's new 5G iPhone 12 went on sale in Brooklyn, New York, U.S. October 23, 2020. REUTERS/Brendan McDermid/File Photo
(Re… [+1765 chars]"
"{'id': 'engadget', 'name': 'Engadget'}",Igor Bonifacic,Amazon's weirdly judgy fitness tracking bracelet is now on sale,"After coming out earlier this year on an invite-only basis, Amazon’s Halo Band activity tracker is now available to anyone in the US who wants to buy one. You can purchase the wearable for $100 on Amazon and Best Buy. It’s available in three colors: black, bl…",https://www.engadget.com/amazon-halo-band-general-availability-140007476.html,https://o.aolcdn.com/images/dims?resize=1200%2C630&crop=1200%2C630%2C0%2C0&quality=95&image_uri=https%3A%2F%2Fs.yimg.com%2Fos%2Fcreatr-uploaded-images%2F2020-12%2Fbd705da0-3bfb-11eb-a3cb-19030f362939&client=amp-blogside-v2&signature=6547cd93188fa08a7585328f5b150a2b15481def,2020-12-14T14:00:07Z,"After coming out earlier this year on an invite-only basis, Amazon’s Halo Band activity tracker is now available to anyone in the US who wants to buy one. You can purchase the wearable for $100 on Am… [+799 chars]"
"{'id': None, 'name': 'MarketWatch'}",By Sarah E. Needleman,The Wall Street Journal: Reddit buys video-sharing app Dubsmash,Reddit Inc. said Monday it bought video-sharing app Dubsmash to expand its presence in one of the hottest corners of the internet: user-created video.,https://www.marketwatch.com/story/reddit-buys-video-sharing-app-dubsmash-11607916615,https://images.mktw.net/im-272874/social,2020-12-14T03:30:00Z,Reddit Inc. said Monday it bought video-sharing app Dubsmash to expand its presence in one of the hottest corners of the internet: user-created video.Fifteen-year-old Reddit says Dubsmashwith its fre… [+1248 chars]
"{'id': None, 'name': 'VentureBeat'}","Rebecca O'Keeffe, Jobbio",5 incredible jobs that are on VentureBeat Careers right now,"SPONSORED JOBS: Every week, some of the most exciting tech companies in the world post their latest and greatest job opportunities on Jobs.VentureBeat, powered by Jobbio. From transformative tech to gaming and beyond, Jobs.VentureBeat helps businesses from al…",https://venturebeat.com/2020/12/14/5-incredible-jobs-that-are-on-venturebeat-careers-right-now/,https://venturebeat.com/wp-content/uploads/2020/12/GettyImages-707455885.jpg?w=1200&strip=all,2020-12-14T17:45:33Z,"Every week, some of the most exciting tech companies in the world post their latest and greatest job opportunities on Jobs.VentureBeat, powered by Jobbio. From transformative tech to gaming and beyon… [+4290 chars]"
"{'id': None, 'name': 'Itmedia.co.jp'}",,豪歌手、競泳で東京オリンピック出場の可能性　マイケル・フェルプスも応援「やってやれ！」,�R�[�f�B�[�E�V���v�\���u�����ӎv��������΂Ȃ��Ăł���v,https://nlab.itmedia.co.jp/nl/articles/2012/14/news112.html,https://image.itmedia.co.jp/nl/articles/2012/14/cover_news112.jpg,2020-12-14T09:00:00Z,"@I[XgAlR[fB[EVv\1213AjIIsbNIlgCAoiInstagram\Bfr[ILAfO10Not@WB
@R[fB[23A2009NYouTubefr[BL[geplClu2WXeBEr[o[vBfr[_AJAi[X[hcA[JÂXujAvRvB
@R[fB[2020NAR[`w{iIg[jOJBInstagramXv[jpeB5JPu10NoAxv100[go^tCI… [+161 chars]"
"{'id': None, 'name': 'Itmedia.co.jp'}",�u�c���^�r�C�˂Ƃ��,コンバーチブル、ロードスター、カブリオレ……　なぜ「オープンカー」にはいろいろ呼び名があるの？,�T�N�b�Ƃ܂Ƃ߂āu�I�[�v���J�[�v�ł������ƌ��������Ȃ�܂����A�g��������Ƃ������Ƃ����邩��ł��B,https://nlab.itmedia.co.jp/nl/articles/2012/14/news034.html,https://image.itmedia.co.jp/nl/articles/2012/14/cover_news034.jpg,2020-12-14T11:00:00Z,"@CAVAOTAqAI[vJ[BJbRCCBuI[vJ[v^CvB
@uI[vJ[v\tR1AB
@uRo[`uvAu[hX^[vpAuJuI^JuIvtXhCcBC^AuoPb^vuXpC_[vB
@JI[vftN}gBStABAtC[WA}[PeBOIgAOB
uJvuv
@A[hX^[XpC_[I[vJ[pv2V[^[X|[cuiJjN}vAJuIRo[`uI^\N}huJ… [+471 chars]"
"{'id': 'the-hindu', 'name': 'The Hindu'}",PTI,Chennithala’s FB post on visually impaired pet dog wins netizens’ hearts,Applause comes from corners cutting across political differences,https://www.thehindu.com/news/national/kerala/chennithalas-fb-post-on-visually-impaired-pet-dog-wins-netizens-hearts/article33329036.ece,https://www.thehindu.com/news/national/kerala/37iroa/article33329032.ece/ALTERNATES/LANDSCAPE_615/15tv-chennithalaFB,2020-12-14T13:21:22Z,"Two days after the heart-wrenching ordeal of a pet dog reported in Kochi, the Leader of Opposition Ramesh Chennithala on Monday shared the touching story of his visually challenged pet canine on soci… [+2637 chars]"
