source,author,title,description,url,urlToImage,publishedAt,content
"{'id': None, 'name': 'Android Central'}",Jerry Hildenbrand,Android Enterprise Essentials will help small businesses secure their data,"Android Enterprise Essentials provides easy and automatic security for any small or medium-sized business.



What you need to know


Android Enterprise Essentials provides core data protection features for small and medium-sized businesses.
Devices purchased…",https://www.androidcentral.com/android-enterprise-essentials-designed-so-smaller-businesses-can-easily-protect-devices-and-data,https://www.androidcentral.com/sites/androidcentral.com/files/styles/large/public/article_images/2020/12/android-enterprise-1.jpg,2020-12-01T19:42:37Z,"You probably have heard about how businesses can administer accounts for people who have a company phone or bring their own phone to work, or maybe you even have experience with it. Typically we thin… [+1854 chars]"
"{'id': 'wired', 'name': 'Wired'}","Matt Burgess, WIRED UK",7 Simple Ways to Make Your Android Phone More Secure,Here's how to lock down your data and stop others from snooping on your personal information.,https://www.wired.com/story/7-simple-ways-to-make-your-android-phone-more-secure/,"https://media.wired.com/photos/5fc5637c319157d9f1bd0c97/191:100/w_1280,c_limit/Security_Android_1229666292.jpg",2020-12-01T14:00:00Z,"Your entire life is contained in that glass slab in your hand. From emails and private messages to photos and videos of your most treasured moments, its all there. However, you probably dont spend an… [+4008 chars]"
