source,author,title,description,url,urlToImage,publishedAt,content
"{'id': None, 'name': 'ExaminerLive'}",Phoebe Fuller,These are the healthiest and unhealthiest parts of South Yorkshire - Yorkshire Live,"<ol><li>These are the healthiest and unhealthiest parts of South Yorkshire  Yorkshire Live
</li><li>Covid death tally increases by 16 in Sheffield and five more across South Yorkshire  The Star
</li><li>View Full coverage on Google News</li></ol>",https://www.examinerlive.co.uk/news/health/healthiest-unhealthiest-parts-south-yorkshire-19404746,https://i2-prod.examinerlive.co.uk/incoming/article19408222.ece/ALTERNATES/s1200/0_MapJPG.jpg,2020-12-06T05:00:00Z,"The healthiest and unhealthiest areas of South Yorkshire have been mapped, thanks to research from various universities.
Researchers have developed a tool which takes into account various factors in… [+6938 chars]"
"{'id': None, 'name': 'Express'}","David Maddox, Political Editor of the Sunday Express","Biden vote fraud claims hit ONE MILLION in five key states, independent investigator says - Daily Express","<ol><li>Biden vote fraud claims hit ONE MILLION in five key states, independent investigator says  Daily Express
</li><li>Fact check: Alleged ‘backdated’ ballots wouldn’t have been counted even if USPS claim true  USA TODAY
</li><li>View Full coverage on Go…",https://www.express.co.uk/news/world/1368787/joe-biden-election-2020-vote-fraud-donald-trump-latest-news,https://cdn.images.express.co.uk/img/dynamic/78/750x445/1368787.jpg,2020-12-06T00:01:00Z,
"{'id': 'mashable', 'name': 'Mashable'}",Jae Thomas,25 stocking stuffers under $25 for everybody on your list,"It's the little things in life that matter the most, right? That means stocking stuffers are an absolutely essential part of Christmas morning. Nobody wants to grab their stocking and open it up to find zilch.
Fortunately, we've got a list of 25 products unde…",https://mashable.com/shopping/dec-6-stocking-stuffers-under-25/,https://mondrian.mashable.com/2020%252F12%252F06%252F62%252Fc2de145fdfab41eea95b6bcf9e0f71ef.7e08a.jpg%252F1200x630.jpg?signature=WT6P424U27PVBe1XmtbMA0MGOYI=,2020-12-06T10:00:00Z,"It's the little things in life that matter the most, right? That means stocking stuffers are an absolutely essential part of Christmas morning. Nobody wants to grab their stocking and open it up to f… [+6706 chars]"
"{'id': None, 'name': 'CNET'}",Ry Crist,Best router deals still live: Upgrade to mesh or Wi-Fi 6 at a discount - CNET,"Cyber Monday may be over, but the router deals still keep coming. Here's what's on sale now.",https://www.cnet.com/news/best-router-deals-still-live-upgrade-to-mesh-or-wi-fi-6-at-a-discount/,https://cnet2.cbsistatic.com/img/9VT4Svb_zo973YqUv9R1o6x76Oo=/1200x630/2020/11/11/6352fb3d-0e4d-45ad-84da-8974270ba663/netgear-orbi-wi-fi-6-mesh-router.jpg,2020-12-06T21:53:00Z,"Show more (7 items)
This story is part of Holiday Gift Guide 2020, CNET's gift picks with expert advice, reviews and recommendations for the latest tech gifts for you and your family.
 While Cyber … [+9241 chars]"
"{'id': None, 'name': 'Instituteforpubliceducation.org'}",View all posts by Sandra Mathison,Monopoly Technology Platforms Are Colonizing Education,Comments,https://instituteforpubliceducation.org/monopoly-technology-platforms-are-colonizing-education/,,2020-12-06T09:07:36Z,"Perspectives is an opportunity for Fellows and others to share their ideas in short, accessible essays. IPE/BC Fellows hold a range of views and interests relative to public education.
Monopoly Tech… [+6808 chars]"
"{'id': None, 'name': 'ReadWrite'}",Jitendra Dabhi,The Ultimate Guide to Website Security for Small Businesses,"Online space continues to thrive as the leading channel for conducting business and communications. In this fast-paced information age, new websites are popping up faster than ever. Here is the ultimate guide to website security for small businesses. Is a Web…",https://readwrite.com/2020/12/06/the-ultimate-guide-to-website-security-for-small-businesses/,https://images.readwrite.com/wp-content/uploads/2020/12/Website-Security-for-Small-Businesses.jpg,2020-12-06T08:09:43Z,"Online space continues to thrive as the leading channel for conducting business and communications. In this fast-paced information age, new websites are popping up faster than ever. Here is the ultim… [+6389 chars]"
"{'id': None, 'name': 'Global Times'}",,Chang'e-5 completes China's first docking in lunar orbit - Global Times,"<ol><li>Chang'e-5 completes China's first docking in lunar orbit  Global Times
</li><li>Chang'e-5: China's unmanned moon probe delivers samples to orbiting spacecraft  The Guardian
</li><li>Chang'e 5 set to start journey to Earth  ecns
</li><li>China’s Moo…",https://www.globaltimes.cn/content/1209142.shtml,http://www.globaltimes.cn/Portals/0/attachment/2020/2020-12-06/2a2d984a-a684-4468-9f65-0d2c2102b1f9.jpeg,2020-12-06T13:56:27Z,"Screen image captured at Beijing Aerospace Control Center in Beijing, capital of China, Dec. 6, 2020 shows the rendezvous and docking of the ascender of China's Chang'e-5 probe with the orbiter-retur… [+6265 chars]"
