source,author,title,description,url,urlToImage,publishedAt,content
"{'id': None, 'name': 'BNNBloomberg.ca'}",Kevin Orland,"BMO, CIBC extend work from home to April as Canada cases surge - BNN","BMO, CIBC extend work from home to April as Canada cases surge  BNNView Full coverage on Google News",https://ampvideo.bnnbloomberg.ca/bmo-cibc-extend-work-from-home-to-april-as-canada-cases-surge-1.1527839,,2020-11-25T22:53:48Z,"Signage is displayed outside the Canadian Imperial Bank of Commerce (CIBC) in the financial district of Toronto, Ontario, Canada, on Friday, Feb. 14, 2020. Canadian stocks declined with global market… [+1859 chars]"
"{'id': None, 'name': 'Global News'}",Chris Jancelewicz,"Justin Bieber, The Weeknd displeased with the Grammys — for different reasons - Global News","Justin Bieber, The Weeknd displeased with the Grammys — for different reasons  Global NewsView Full coverage on Google News",https://globalnews.ca/news/7483142/justin-bieber-the-weeknd-grammys-nominations/,https://globalnews.ca/wp-content/uploads/2020/11/justin-bieber-the-weeknd-e1606314868850.jpg?quality=85&strip=all&crop=0px%2C0px%2C2398px%2C1267px&resize=720%2C379,2020-11-25T14:51:23Z,"Canadian music artists Justin Bieber and The Weeknd (real name Abel Tesfaye) aren’t very happy with the Grammys right now.
The 2021 Grammy nominations were announced Tuesday, and fan-favourite Biebe… [+3639 chars]"
"{'id': None, 'name': 'Telegraph.co.uk'}","By
Harry Yorke,",Minister resigns in foreign aid row as Archbishop of Canterbury denounces 'shameful' cut - Telegraph.co.uk,Minister resigns in foreign aid row as Archbishop of Canterbury denounces 'shameful' cut  Telegraph.co.ukView Full coverage on Google News,https://www.telegraph.co.uk/politics/2020/11/25/minister-resigns-archbishop-canterbury-denounces-foreign-aid/,https://www.telegraph.co.uk/content/dam/global-health/2020/11/25/TELEMMGLPICT000245290089_trans_NvBQzQNjv4Bq3Vwa6_22_2LIriWhljZ7IyU7Je8lrZ-yqPlY5C9byGo.jpeg?impolicy=logo-overlay,2020-11-25T19:58:00Z,"The Most Rev Justin Welby said the announcement had been ""made worse"" by the fact that Mr Sunak had set no ""date for restoration"", adding : ""I join others in urging MPs to reject it for the good of t… [+1345 chars]"
"{'id': None, 'name': 'Telegraph.co.uk'}",Allister Heath,"Britain is facing ruin, but deluded Tories are still refusing to accept it - Telegraph.co.uk","Britain is facing ruin, but deluded Tories are still refusing to accept it  Telegraph.co.ukView Full coverage on Google News",https://www.telegraph.co.uk/news/2020/11/25/britain-facing-ruin-deludedtories-still-refusing-accept/,https://www.telegraph.co.uk/content/dam/news/2020/11/25/BOB-261120_1_trans_NvBQzQNjv4Bqeo_i_u9APj8RuoebjoAHt0k9u7HhRJvuo-ZLenGRumA.jpg?impolicy=logo-overlay,2020-11-25T21:30:00Z,"Yes, incredibly, the total cost of servicing our debt will fall to a new historical low of 1.7 per cent of government revenues next year, and yes we have been able to borrow longer-term than other co… [+2216 chars]"
